{"$schema":"https://agentskeptic.com/schemas/verification-diff-certificate-v1.schema.json","comparisonKind":"outcome_certificate_v3_semantic","completenessChanged":true,"current":{"certificateSha256":"e881dd23b5997e60d5244f66fa2e92dced92f287adfafc5b11d6fefab04d83e7","highStakesReliance":"permitted","releaseCriticalVerdict":"trusted","runKind":"contract_sql","stateRelation":"matches_expectations"},"determinacy":{"currentClass":"established_positive","currentRank":2,"priorClass":"established_negative","priorRank":1},"evidenceCompletenessProjection":{"current":{"blockerCategory":"none","supportLabel":null},"prior":{"blockerCategory":"state_mismatch","supportLabel":null}},"headline":"Verification posture improved between prior and current Outcome Certificates.","highStakesReliance":{"changed":true,"current":"permitted","prior":"prohibited"},"lessDeterminate":false,"limits":{"certificateOnly":true,"noEvents":true,"noStepStructuralDiff":true},"nextStepHint":{"command":"agentskeptic compare --manifest <compare-run-manifest.json>","docAnchor":"docs/agentskeptic.md#cross-run-comparison-normative"},"postureMovement":"improved","prior":{"certificateSha256":"35ff2ff79bdb3236b598431f334f2bbdfba6602be1f5efb9f98126b2f6be4e4a","highStakesReliance":"prohibited","releaseCriticalVerdict":"not_trusted","runKind":"contract_sql","stateRelation":"does_not_match"},"recommendedNextAction":"Promotion decision may proceed consistent with improved trust projections; archive both certificates. For structural compare use `agentskeptic compare --manifest <compare-run-manifest.json>` (docs/agentskeptic.md#cross-run-comparison-normative).","releaseCriticalVerdict":{"changed":true,"current":"trusted","prior":"not_trusted"},"runKind":{"changed":false,"current":"contract_sql","prior":"contract_sql"},"schemaVersion":1,"stateRelation":{"changed":true,"current":"matches_expectations","prior":"does_not_match"},"workflowId":"wf_fixture_diff"}
