{"$schema":"https://agentskeptic.com/schemas/verification-diff-certificate-v1.schema.json","comparisonKind":"outcome_certificate_v3_semantic","completenessChanged":true,"current":{"certificateSha256":"13fb9e61ba0b7c650c4bbfb8cdf12e0fbb1d6ba2a177b5c0b34c71fb336eb680","highStakesReliance":"prohibited","releaseCriticalVerdict":"not_trusted","runKind":"contract_sql","stateRelation":"does_not_match"},"determinacy":{"currentClass":"established_negative","currentRank":1,"priorClass":"not_established","priorRank":0},"evidenceCompletenessProjection":{"current":{"blockerCategory":"state_mismatch","supportLabel":null},"prior":{"blockerCategory":"timing_or_window","supportLabel":null}},"headline":"Verification posture weakened between prior and current Outcome Certificates.","highStakesReliance":{"changed":true,"current":"prohibited","prior":"permitted"},"lessDeterminate":false,"limits":{"certificateOnly":true,"noEvents":true,"noStepStructuralDiff":true},"nextStepHint":{"command":"agentskeptic compare --manifest <compare-run-manifest.json>","docAnchor":"docs/agentskeptic.md#cross-run-comparison-normative"},"postureMovement":"weakened","prior":{"certificateSha256":"563aec7b667b59f9631498dbca3415a511056e2b0dc6eec5a5c8b0dea2347d47","highStakesReliance":"permitted","releaseCriticalVerdict":"unknown","runKind":"contract_sql","stateRelation":"not_established"},"recommendedNextAction":"Hold promotion or widen review: trust projections regressed versus the prior certificate; remediate downstream state / inputs before relying on current. For structural compare use `agentskeptic compare --manifest <compare-run-manifest.json>` (docs/agentskeptic.md#cross-run-comparison-normative).","releaseCriticalVerdict":{"changed":true,"current":"not_trusted","prior":"unknown"},"runKind":{"changed":false,"current":"contract_sql","prior":"contract_sql"},"schemaVersion":1,"stateRelation":{"changed":true,"current":"does_not_match","prior":"not_established"},"workflowId":"wf_fixture_diff"}
