{"$schema":"https://agentskeptic.com/schemas/verification-diff-certificate-v1.schema.json","comparisonKind":"outcome_certificate_v3_semantic","completenessChanged":false,"current":{"certificateSha256":"87c661f4d599b88b33bc2b09e4064ab52fab23644a7f2c8700afec270f7e496d","highStakesReliance":"permitted","releaseCriticalVerdict":"trusted","runKind":"contract_sql","stateRelation":"matches_expectations"},"determinacy":{"currentClass":"established_positive","currentRank":2,"priorClass":"established_positive","priorRank":2},"evidenceCompletenessProjection":{"current":{"blockerCategory":"none","supportLabel":null},"prior":{"blockerCategory":"none","supportLabel":null}},"headline":"Verification posture improved between prior and current Outcome Certificates.","highStakesReliance":{"changed":false,"current":"permitted","prior":"permitted"},"lessDeterminate":false,"limits":{"certificateOnly":true,"noEvents":true,"noStepStructuralDiff":true},"nextStepHint":{"command":"agentskeptic compare --manifest <compare-run-manifest.json>","docAnchor":"docs/agentskeptic.md#cross-run-comparison-normative"},"postureMovement":"improved","prior":{"certificateSha256":"3aadecbd69834388fad5f3180ce82a3ccdebb9fc29f627c781548b6d0a2546ea","highStakesReliance":"permitted","releaseCriticalVerdict":"unknown","runKind":"contract_sql","stateRelation":"matches_expectations"},"recommendedNextAction":"Promotion decision may proceed consistent with improved trust projections; archive both certificates. For structural compare use `agentskeptic compare --manifest <compare-run-manifest.json>` (docs/agentskeptic.md#cross-run-comparison-normative).","releaseCriticalVerdict":{"changed":true,"current":"trusted","prior":"unknown"},"runKind":{"changed":false,"current":"contract_sql","prior":"contract_sql"},"schemaVersion":1,"stateRelation":{"changed":false,"current":"matches_expectations","prior":"matches_expectations"},"workflowId":"wf_fixture_diff"}
