{"$schema":"https://agentskeptic.com/schemas/verification-diff-certificate-v1.schema.json","comparisonKind":"outcome_certificate_v3_semantic","completenessChanged":true,"current":{"certificateSha256":"5a5621705a1ebfd10779f70ccf7942d35cafea5873b6b300b2a9a3a617cdfee7","highStakesReliance":"permitted","releaseCriticalVerdict":"unknown","runKind":"contract_sql","stateRelation":"matches_expectations"},"determinacy":{"currentClass":"established_positive","currentRank":2,"priorClass":"not_established","priorRank":0},"evidenceCompletenessProjection":{"current":{"blockerCategory":"none","supportLabel":null},"prior":{"blockerCategory":"registry_resolution","supportLabel":null}},"headline":"Verification posture improved between prior and current Outcome Certificates.","highStakesReliance":{"changed":false,"current":"permitted","prior":"permitted"},"lessDeterminate":false,"limits":{"certificateOnly":true,"noEvents":true,"noStepStructuralDiff":true},"nextStepHint":{"command":"agentskeptic compare --manifest <compare-run-manifest.json>","docAnchor":"docs/agentskeptic.md#cross-run-comparison-normative"},"postureMovement":"improved","prior":{"certificateSha256":"10ad516164dcd07234a8df92fc26ec2c1567d826086f7ece8ae35d30429cff6e","highStakesReliance":"permitted","releaseCriticalVerdict":"unknown","runKind":"contract_sql","stateRelation":"not_established"},"recommendedNextAction":"Promotion decision may proceed consistent with improved trust projections; archive both certificates. For structural compare use `agentskeptic compare --manifest <compare-run-manifest.json>` (docs/agentskeptic.md#cross-run-comparison-normative).","releaseCriticalVerdict":{"changed":false,"current":"unknown","prior":"unknown"},"runKind":{"changed":false,"current":"contract_sql","prior":"contract_sql"},"schemaVersion":1,"stateRelation":{"changed":true,"current":"matches_expectations","prior":"not_established"},"workflowId":"wf_fixture_diff"}
