{"$schema":"https://agentskeptic.com/schemas/verification-diff-certificate-v1.schema.json","comparisonKind":"outcome_certificate_v3_semantic","completenessChanged":false,"current":{"certificateSha256":"d9f73ad92058b7db07cb5b2ff27dae0e2d3b9d64580159acf724edd1d8fc2191","highStakesReliance":"permitted","releaseCriticalVerdict":"trusted","runKind":"quick_preview","stateRelation":"matches_expectations"},"determinacy":{"currentClass":"established_positive","currentRank":2,"priorClass":"established_positive","priorRank":2},"evidenceCompletenessProjection":{"current":{"blockerCategory":"none","supportLabel":null},"prior":{"blockerCategory":"none","supportLabel":null}},"headline":"Verification posture drifted: material certificate fields changed without a single clear improved/weakened trust story.","highStakesReliance":{"changed":false,"current":"permitted","prior":"permitted"},"lessDeterminate":false,"limits":{"certificateOnly":true,"noEvents":true,"noStepStructuralDiff":true},"nextStepHint":{"command":"agentskeptic compare --manifest <compare-run-manifest.json>","docAnchor":"docs/agentskeptic.md#cross-run-comparison-normative"},"postureMovement":"drifted","prior":{"certificateSha256":"d73f9ff7cfa1f996ed2df6c6e3ed81e58bdba068e68bb198a7f92017f99e5dfd","highStakesReliance":"permitted","releaseCriticalVerdict":"trusted","runKind":"contract_sql","stateRelation":"matches_expectations"},"recommendedNextAction":"Reviewer should reconcile why evidence or run posture labels moved while primary trust projections stayed aligned; optionally rerun live verification. For structural compare use `agentskeptic compare --manifest <compare-run-manifest.json>` (docs/agentskeptic.md#cross-run-comparison-normative).","releaseCriticalVerdict":{"changed":false,"current":"trusted","prior":"trusted"},"runKind":{"changed":true,"current":"quick_preview","prior":"contract_sql"},"schemaVersion":1,"stateRelation":{"changed":false,"current":"matches_expectations","prior":"matches_expectations"},"workflowId":"wf_fixture_diff"}
