{"$schema":"https://agentskeptic.com/schemas/verification-diff-certificate-v1.schema.json","comparisonKind":"outcome_certificate_v3_semantic","completenessChanged":true,"current":{"certificateSha256":"6ee8cf117cb9e827aa85795a6c30f8e8c92350e8f17c8fd55202fc62c92f0c7c","highStakesReliance":"permitted","releaseCriticalVerdict":"trusted","runKind":"contract_sql","stateRelation":"matches_expectations"},"determinacy":{"currentClass":"established_positive","currentRank":2,"priorClass":"established_positive","priorRank":2},"evidenceCompletenessProjection":{"current":{"blockerCategory":"timing_or_window","supportLabel":null},"prior":{"blockerCategory":"none","supportLabel":null}},"headline":"Verification posture drifted: material certificate fields changed without a single clear improved/weakened trust story.","highStakesReliance":{"changed":false,"current":"permitted","prior":"permitted"},"lessDeterminate":false,"limits":{"certificateOnly":true,"noEvents":true,"noStepStructuralDiff":true},"nextStepHint":{"command":"agentskeptic compare --manifest <compare-run-manifest.json>","docAnchor":"docs/agentskeptic.md#cross-run-comparison-normative"},"postureMovement":"drifted","prior":{"certificateSha256":"52331f9ce13e98bedd245392b03c243af3000de405dcfc0c3b6c3bf8a2c3bd44","highStakesReliance":"permitted","releaseCriticalVerdict":"trusted","runKind":"contract_sql","stateRelation":"matches_expectations"},"recommendedNextAction":"Reviewer should reconcile why evidence or run posture labels moved while primary trust projections stayed aligned; optionally rerun live verification. For structural compare use `agentskeptic compare --manifest <compare-run-manifest.json>` (docs/agentskeptic.md#cross-run-comparison-normative).","releaseCriticalVerdict":{"changed":false,"current":"trusted","prior":"trusted"},"runKind":{"changed":false,"current":"contract_sql","prior":"contract_sql"},"schemaVersion":1,"stateRelation":{"changed":false,"current":"matches_expectations","prior":"matches_expectations"},"workflowId":"wf_fixture_diff"}
