{"$schema":"https://agentskeptic.com/schemas/verification-diff-certificate-v1.schema.json","comparisonKind":"outcome_certificate_v3_semantic","completenessChanged":true,"current":{"certificateSha256":"2591cf880e29e3e1de4d76f675c7c4de5387d6f2aa52273bf4e37bc90d76c8d9","highStakesReliance":"prohibited","releaseCriticalVerdict":"not_trusted","runKind":"contract_sql","stateRelation":"does_not_match"},"determinacy":{"currentClass":"established_negative","currentRank":1,"priorClass":"established_positive","priorRank":2},"evidenceCompletenessProjection":{"current":{"blockerCategory":"state_mismatch","supportLabel":null},"prior":{"blockerCategory":"none","supportLabel":null}},"headline":"Verification posture weakened between prior and current Outcome Certificates.","highStakesReliance":{"changed":true,"current":"prohibited","prior":"permitted"},"lessDeterminate":false,"limits":{"certificateOnly":true,"noEvents":true,"noStepStructuralDiff":true},"nextStepHint":{"command":"agentskeptic compare --manifest <compare-run-manifest.json>","docAnchor":"docs/agentskeptic.md#cross-run-comparison-normative"},"postureMovement":"weakened","prior":{"certificateSha256":"a7db0c5f02ce5c79f7ae935e32f0b222b890ba9ff251e59d120dbc58c03e5b6a","highStakesReliance":"permitted","releaseCriticalVerdict":"trusted","runKind":"contract_sql","stateRelation":"matches_expectations"},"recommendedNextAction":"Hold promotion or widen review: trust projections regressed versus the prior certificate; remediate downstream state / inputs before relying on current. For structural compare use `agentskeptic compare --manifest <compare-run-manifest.json>` (docs/agentskeptic.md#cross-run-comparison-normative).","releaseCriticalVerdict":{"changed":true,"current":"not_trusted","prior":"trusted"},"runKind":{"changed":false,"current":"contract_sql","prior":"contract_sql"},"schemaVersion":1,"stateRelation":{"changed":true,"current":"does_not_match","prior":"matches_expectations"},"workflowId":"wf_fixture_diff"}
