{"$schema":"https://agentskeptic.com/schemas/verification-diff-certificate-v1.schema.json","comparisonKind":"outcome_certificate_v3_semantic","completenessChanged":false,"current":{"certificateSha256":"174d73b569e3a32bfd9fcba5fafbc66f850aaa32c69e2220b3f77c302b1b17e3","highStakesReliance":"permitted","releaseCriticalVerdict":"trusted","runKind":"contract_sql","stateRelation":"not_established"},"determinacy":{"currentClass":"not_established","currentRank":0,"priorClass":"established_positive","priorRank":2},"evidenceCompletenessProjection":{"current":{"blockerCategory":"none","supportLabel":null},"prior":{"blockerCategory":"none","supportLabel":null}},"headline":"Verification became less determinate: trust dimensions lost a determinate established conclusion.","highStakesReliance":{"changed":false,"current":"permitted","prior":"permitted"},"lessDeterminate":true,"limits":{"certificateOnly":true,"noEvents":true,"noStepStructuralDiff":true},"nextStepHint":{"command":"agentskeptic compare --manifest <compare-run-manifest.json>","docAnchor":"docs/agentskeptic.md#cross-run-comparison-normative"},"postureMovement":"less_determinate","prior":{"certificateSha256":"ec042f400332b18c6b7472fecb47d2e7b0506734fc3d1b99d440aa28b3765c9e","highStakesReliance":"permitted","releaseCriticalVerdict":"trusted","runKind":"contract_sql","stateRelation":"matches_expectations"},"recommendedNextAction":"Treat the current artifact as withholding a determinate grounding that the prior certificate had; restore observability inputs or rerun verification. For structural compare use `agentskeptic compare --manifest <compare-run-manifest.json>` (docs/agentskeptic.md#cross-run-comparison-normative).","releaseCriticalVerdict":{"changed":false,"current":"trusted","prior":"trusted"},"runKind":{"changed":false,"current":"contract_sql","prior":"contract_sql"},"schemaVersion":1,"stateRelation":{"changed":true,"current":"not_established","prior":"matches_expectations"},"workflowId":"wf_fixture_diff"}
